{
  "version": 1,
  "id": "etcdraft-command-agreement-calibration-v1",
  "profile_id": "raft-campaign/raft-three-node-cft-v1",
  "profile_digest": "09e9e507c84234c15cebf942d5d43aa08511cc0d6a48d7c3dc36aa3399dc14b6",
  "max_total_runs": 1,
  "max_total_decisions": 96,
  "plans": [
    {
      "id": "replicate-one-command",
      "targets": [
        "ordering.propose-commit"
      ],
      "prepare": [
        {"op": "inject", "kind": "campaign", "target": "n1"},
        {"op": "drain", "count": 200}
      ],
      "stimuli": [
        {"kind": "propose", "target": "n1", "payload": {"value": "public-calibration-command"}}
      ],
      "search": {
        "strategy": "dfs",
        "config": {
          "max_runs": 1,
          "budget_per_run": 96,
          "decision_budget": 96,
          "seed": 0,
          "actions": {
            "drop_messages": false,
            "duplicate_messages": false,
            "max_duplicates_per_run": 0
          }
        }
      }
    }
  ]
}
